ID,created_at,text,likes,in reply to,retweeted
1293319568631398400,2020-08-11 22:53:08,Hollywood stars were ecstatic after Joe Biden selected Sen. Kamala Harris (D-CA) to be his vice presidential runnin… https://t.co/GRxVHTLvZt,418,,False
1293314493259358219,2020-08-11 22:32:58,The choice of Sen. Kamala Harris (D-CA) as former Vice President Joe Biden’s running mate on Tuesday marks Biden’s… https://t.co/fyNNbnfkGV,787,,False
1293308903766265860,2020-08-11 22:10:45,The New York Times described Sen. Kamala Harris (I-VT) as a “pragmatic moderate” in its report on her selection to… https://t.co/4Uljox2nSx,205,,False
1293303624630665216,2020-08-11 21:49:47,Watch Live: President Donald Trump Holds a Press Conference https://t.co/y0q3XEflBr,188,,False
1293302301512343558,2020-08-11 21:44:31,The Burlington City Council on Monday voted unanimously to launch a task force to study reparations for residents w… https://t.co/mSEwGqwwHV,91,,False
1293297241671847937,2020-08-11 21:24:25,Education media are reporting that most of the nation’s large public school districts have opted for a totally remo… https://t.co/NyAwUsyozj,61,,False
1293292058334175234,2020-08-11 21:03:49,RT @AlexMarlow: I'm old enough to remember when Kamala Harris said Joe Biden worked with segregationists https://t.co/mbatNRDuPy,0,,False
1293291963085717505,2020-08-11 21:03:26,President Donald Trump’s re-election campaign quickly published an attack ad targeting former Vice President Joe Bi… https://t.co/8aLLTB3MZ0,1193,,False
1293291827970355206,2020-08-11 21:02:54,"Delta Air Lines CEO Ed Bastian told NBC's Today that the company has added 100 travelers to its ""no fly list"" over… https://t.co/IMNMpDDYm8",103,,False
1293288619034193921,2020-08-11 20:50:09,"RT @AlexMarlow: BREAKING: Kamala Harris partners with a man she believes is a sexual predator.
https://t.co/TwBmTLbOB4",0,,False
1293286451589914624,2020-08-11 20:41:32,Barbra Streisand is lending her voice to a LGBTQ-themed political campaign intended to mobilize the LGBTQ vote agai… https://t.co/jBzbkU7prl,81,,False
1293284339438977027,2020-08-11 20:33:09,RT @charliespiering: Trump: Kamala Harris Was 'A Thud' in the Democrat Presidential Primary https://t.co/YefQhg4MKM via @BreitbartNews,0,,False
1293281893396422667,2020-08-11 20:23:26,"RT @joelpollak: Poorly worded sentence: implies @KamalaHarris will be the one ""to lead this nation starting in January 2021."" https://t.co/…",0,,False
1293281024504455168,2020-08-11 20:19:58,Presumptive Democrat nominee Joe Biden has selected Sen. Kamala Harris (D-CA) to be his running mate. https://t.co/RbvDPH7wnt,369,,False
1293279717324476422,2020-08-11 20:14:47,The Democratic Party’s presumptive nominee Joe Biden has chosen the woman who will be his vice presidential running… https://t.co/HrQiYEilP6,122,,False
1293279430673158153,2020-08-11 20:13:38,A Chicago alderman is calling Chicago Mayor Lori Lightfoot “unprepared” to handle the rioting and in the city and t… https://t.co/7l17ZyIEKo,889,,False
1293274028216668161,2020-08-11 19:52:10,Congressional candidate Laura Loomer claimed on Monday that Comcast Xfinity has banned her campaign from sending fu… https://t.co/ldAYhP1QxN,595,,False
1293268761794011137,2020-08-11 19:31:15,"Sidney Powell, the attorney for former National Security Advisor Lt. Gen. Michael Flynn (Ret.), told the U.S. Court… https://t.co/fvWFSmEc4j",1045,,False
1293263543316426752,2020-08-11 19:10:31,"Rep. Michael Waltz says Joe Biden picking Susan Rice for his vice presidential running mate would be ""bad for our m… https://t.co/ndBfBFOmV5",484,,False
1293258211848531971,2020-08-11 18:49:19,President @realDonaldTrump told Breitbart News in an exclusive interview that House Speaker Nancy Pelosi and Senate… https://t.co/Z8uPnwQc8u,1058,,False
1293252922705424394,2020-08-11 18:28:18,RINO John Kasich is righteous and pure--a modern day Saint. https://t.co/eko2MSlm7N,542,,False
1293247374077304832,2020-08-11 18:06:16,"Nearly 200 police officers swarmed the offices of Apple Daily, one of Hong Kong's most-read anti-communist newspape… https://t.co/3eUE5n62Tc",215,,False
1293242092970549248,2020-08-11 17:45:16,UPDATE: The U.S. Secret Service issued a report on the officer involved shooting that ocurred Monday outside of the… https://t.co/pFGMalcR0i,201,,False
1293240029335236608,2020-08-11 17:37:04,RT @AWRHawkins: Letitia James Called NRA ‘Terrorist Organization’ Before She Was NY AG ⁦@BreitbartNews⁩  https://t.co/u7mwXqcn2m,0,,False
1293236433684180992,2020-08-11 17:22:47,"President @RealDonaldTrump: “It’s the last thing I’m thinking about right now, is a China phase two deal, after wha… https://t.co/lKsiT9WN5T",783,,False
1293236130331217920,2020-08-11 17:21:35,President Trump now leads presumptive Democratic presidential nominee Joe Biden in the key battleground state of No… https://t.co/E3w7otWgoF,1171,,False
1293230526179028994,2020-08-11 16:59:19,President Trump has a message about Cheat-by-Mail: https://t.co/9HVXsXzzV8,740,,False
1293224719160926210,2020-08-11 16:36:14,Will Biden disavow? https://t.co/wTVFUhU5Zu,244,,False
1293224707878260744,2020-08-11 16:36:11,RT @BreitbartTexas: Jaeson Jones Exclusive: Mexican Cartel Labs Are Flooding U.S. with Meth https://t.co/QRU0UMadqq,0,,False
1293224687330381826,2020-08-11 16:36:07,RT @carney: Survey Shows Twice as Many Small Businesses Say They Can Survive Current Conditions https://t.co/u4AypOwRWu via @BreitbartNews,0,,False
1293219927319552000,2020-08-11 16:17:12,Pocahontas Bagging that Biden Cash! https://t.co/gmzLxwDPFg,267,,False
1293214623693508608,2020-08-11 15:56:07,All eyes on the DOJ to take action. https://t.co/fiDgIPJLjO,2203,,False
1293209344046256128,2020-08-11 15:35:08,Eye-Opener: Hundred of Indians are reporting caste-based discrimination by Indians employed by American tech compan… https://t.co/1281mNO2Zm,225,,False
1293203903618732041,2020-08-11 15:13:31,Biden is the far-Left's empty vessel #TrojanHorse https://t.co/Chgdf9rWKv,596,,False
1293198420803563522,2020-08-11 14:51:44,Everyday working-class Americans are rising up to #BackTheBlue. https://t.co/JNOMN6ZAay,1064,,False
1293192878337011713,2020-08-11 14:29:43,Acting Department of Homeland Security Chad Wolf tweeted Monday that in the ten days since federal law enforcement… https://t.co/V83bKJ5hEd,461,,False
1293187583921414144,2020-08-11 14:08:40,"Nearly 200 police officers swarmed the offices of Apple Daily, one of Hong Kong’s most-read anti-communist newspape… https://t.co/pCcJF1HMbH",409,,False
1293182532478017536,2020-08-11 13:48:36,Seattle's KOMO reported that Seattle Police Chief Carmen Best has announced that she will retire from the Seattle P… https://t.co/soNabSwhzC,445,,False
1293177446913716224,2020-08-11 13:28:24,An additional 5.9 million people in the United States are on food stamps since the coronavirus pandemic began in Ma… https://t.co/sEEAA5qxYE,97,,False
1293171950823636992,2020-08-11 13:06:33,President Donald Trump on Tuesday said it was a disgrace the NBA continued to cater to China despite their known hu… https://t.co/ClGNSafekp,1006,,False
1293166757927149568,2020-08-11 12:45:55,CRIME WAVE UPDATE: Shootings in New York City at this point in 2020 are on track to surpass the number of shootings… https://t.co/o9K6DDGk2n,447,,False
1293161600048914432,2020-08-11 12:25:25,Bahahaha https://t.co/gMLKxi4u2Y,2223,,False
1293156316278665219,2020-08-11 12:04:26,Report: Chinese-owned social media platform TikTok plans to sue the Trump administration over an executive order ba… https://t.co/27X73ABGjt,311,,False
1293150939646431232,2020-08-11 11:43:04,Chuck Schumer is FUMING MAD President Trump took action to help tens of millions of working-class Americans who are… https://t.co/K7rHKgMxoW,2564,,False
1293145613995999232,2020-08-11 11:21:54,CRIME WAVE UPDATE: Shootings in New York City at this point in 2020 are on track to surpass the number of shootings… https://t.co/Phf0MNN7MJ,772,,False
1293140196666613762,2020-08-11 11:00:22,"RNC Chair on GOP Convention: ""There’s going to be some surprises...."" https://t.co/sFFWoC79pm",940,,False
1293030576950325248,2020-08-11 03:44:47,Privacy-based search engine DuckDuckGo released a study on Monday which found that allowing smartphone users to cho… https://t.co/WqkHYVDcCF,2149,,False
1293025110836748293,2020-08-11 03:23:04,Far-Left NBC News blocks and tackles for Democrats (as usual) with just 85 days until the election. https://t.co/TR4eu4VUAS,365,,False
1293019935921385478,2020-08-11 03:02:30,The Seattle City Council approved proposals Monday that would reduce the police department by as many as 100 office… https://t.co/wyW15c3Ar7,311,,False
1293019753477558274,2020-08-11 03:01:47,They are also prohibited under current coronavirus restrictions which bans gatherings larger than 30 people. https://t.co/0avBs1bOPQ,95,,False
1293014359665455104,2020-08-11 02:40:21,Out of This World Wokeness! https://t.co/Jcj5xkH1Is,164,,False
1293008698022014977,2020-08-11 02:17:51,Trump goes trolling! https://t.co/VnKnvIB64J,669,,False
1293003270181588994,2020-08-11 01:56:17,Birds of a feather https://t.co/xGwV4JtsNX,748,,False
1293001496519413760,2020-08-11 01:49:14,"RT @AlexMarlow: BREAKING: New York bread thieves on track to cause more shootings in 2020 than 2018 and 2019 combined.
https://t.co/WloWLZu…",0,,False
1292997911949737985,2020-08-11 01:34:59,Make. It. Stop. https://t.co/YhPbr3S1GP,1800,,False
1292992802599718913,2020-08-11 01:14:41,Pasco County Sheriff Chris Nocco said a homeowner who shot and killed 55-year-old Ronald Fleet Saturday afternoon w… https://t.co/sI93APDYVL,1033,,False
1292987645652537345,2020-08-11 00:54:11,More rays of hope in the Sunshine State https://t.co/jNC5mbjQ3T,682,,False
1292981875179388928,2020-08-11 00:31:16,Joe Biden isn't the only one who must be coddled and protected by the Establishment Media. https://t.co/WzrXxCJh1j,234,,False
1292976211417804801,2020-08-11 00:08:45,Gavin Newsom said California could not afford to pay its share of President Donald Trump's new expansion of unemplo… https://t.co/lZsMW3pcOe,2592,,False
1292971006282346496,2020-08-10 23:48:04,Now time to crack down. https://t.co/LV1e4aixM9,838,,False
1292967883795042305,2020-08-10 23:35:40,"Seattle rioters looting stores...for ""justice,"" of course. https://t.co/xZrsnBIkqM",374,,False
1292962665980203008,2020-08-10 23:14:56,"Seattle rioters looting stores...for ""justice,"" of course. https://t.co/HfSCAeyt0h",373,,False
1292957245475561473,2020-08-10 22:53:23,"Where are the so-called ""fact-checkers""? When does the Big Tech censorship and suppression begin? Oh...that's right… https://t.co/poBfUeFGQp",646,,False
1292951760047411200,2020-08-10 22:31:36,"A multi-ethnic coalition against the Communist Party of China convened at an event Sunday in Washington, DC, urging… https://t.co/AAAptsEtH3",479,,False
1292946314007851009,2020-08-10 22:09:57,President Donald Trump on Monday abruptly left a press conference after what appeared to be a Secret Service agent… https://t.co/1AIljAbgBp,425,,False
1292942124141416451,2020-08-10 21:53:18,Wow. https://t.co/96FdMU18I2,356,,False
1292937192432689153,2020-08-10 21:33:42,"RT @AlexMarlow: Police raided an anti-communist newspaper in Hong Kong, and arrested its owners for:

-”collusion with foreign powers”
-pro…",0,,False
1292936629028618246,2020-08-10 21:31:28,"Lebanese Prime Minister Hassan Diab resigned on Monday afternoon, following the resignations of several other top m… https://t.co/FoJzYcZ4jl",143,,False
1292931487088640000,2020-08-10 21:11:02,"Republican grassroots fundraising platform WinRed raised $164.3 million in July, including more than $15.7 million… https://t.co/puirZGmqgL",538,,False
1292925498163593223,2020-08-10 20:47:14,They never were. https://t.co/DSAXRuJyun,719,,False
1292919453026582528,2020-08-10 20:23:13,California Governor Gavin Newsom said Monday that the state could not afford to pay its share of President Donald T… https://t.co/skocnN1LDH,2917,,False
1292913708331655171,2020-08-10 20:00:23,"REVEALED: Cook County State’s Attorney Kim Foxx has dropped over 25,000 felony cases. 

https://t.co/351V14L9Kz",2681,,False
1292911330257666053,2020-08-10 19:50:56,"RT @AlexMarlow: Just the Washington Post glorifying domestic terrorism, pay no attention.
https://t.co/THAF4MeT53",0,,False
1292908227374583809,2020-08-10 19:38:37,Magnificent Mile Democrat Denial https://t.co/x6E9YNj3E9,399,,False
1292902725986983938,2020-08-10 19:16:45,Truth. https://t.co/moEg2SmYZn,1527,,False
1292897161542356992,2020-08-10 18:54:38,Chicago Mayor Lori Lightfoot devoted personal attention to clearing a beach party but could not stop looters from r… https://t.co/hasHQUrDB5,2109,,False
1292891479904595969,2020-08-10 18:32:04,"Chicago Democrat Mayor Lori Lightfoot: ""We do not need federal troops in Chicago. Period. Full stop."" https://t.co/fhReAdlkgw",2641,,False
1292887150858506244,2020-08-10 18:14:52,"Chicago officials announced Monday morning that police would be placed on high alert, with 12-hour shifts and expan… https://t.co/YSLLv2IIa1",503,,False
1292881559037542400,2020-08-10 17:52:38,"Nearly 200 police officers swarmed the offices of Apple Daily, one of Hong Kong’s most-read anti-communist newspape… https://t.co/Foi5KzRguE",292,,False
1292876404271521793,2020-08-10 17:32:09,The riots continue in Democrat-controlled Portland without Feds as local police stand down. https://t.co/PdMrj4i9FS,340,,False
1292871279658270721,2020-08-10 17:11:48,"The Biden Humiliation has been happening for a long, long time. https://t.co/Ebj27NJc9Q",590,,False
1292865906222170118,2020-08-10 16:50:26,***Viewer discretion advised*** https://t.co/fDDx3ZkA2b,195,,False
1292860912798445569,2020-08-10 16:30:36,"Emergency personnel are responding to what has been described as a “major explosion” in Baltimore, with “multiple p… https://t.co/a5fHAhyDkw",228,,False
1292855851829657600,2020-08-10 16:10:29,"Black residents of Portland, Oregon, are reportedly feeling silenced and drowned out by ongoing Black Lives Matter… https://t.co/YxuQABN2bX",981,,False
1292850141154680835,2020-08-10 15:47:48,Trump goes trolling! https://t.co/wVa9xc039r,623,,False
1292844644544520192,2020-08-10 15:25:57,Joe Biden isn't the only one who must be coddled and protected by the Establishment Media... https://t.co/dkqyew0HE1,225,,False
1292839492206944260,2020-08-10 15:05:29,"HarperCollins released the cover of Breitbart News Entertainment Editor @JeromeEHudson's book, 50 Things They Don’t… https://t.co/d0eijcpREy",445,,False
1292836669352292355,2020-08-10 14:54:16,Big words from little Beto https://t.co/RrypzqysNq,829,,False
1292831605099302914,2020-08-10 14:34:08,Make. It. Stop. https://t.co/4cl9c6tWjq,2893,,False
1292826555454980103,2020-08-10 14:14:05,Justice for Juicy! https://t.co/fVLFxDJOFP,316,,False
1292820884982464517,2020-08-10 13:51:33,More New Yorkers lock and load https://t.co/7BTbnLdv7h,1045,,False
1292815563165753345,2020-08-10 13:30:24,This is Lori Lightfoot's Chicago: https://t.co/7tSZxY2reg,805,,False
1292810526628642818,2020-08-10 13:10:23,Pencil Neck is STILL on the Russia Hoax! https://t.co/x7Dc41o1lN,547,,False
1314406552179273728,2020-10-09 03:25:17,Biden-backer Cardi B sparks backlash with for appearing to support Armenia amid their ongoing military conflict wit… https://t.co/AclkTJLsZy,343,,False
1314400728962695169,2020-10-09 03:02:08,Clowns. https://t.co/L74PlqawFo,3769,,False
1314395363084828673,2020-10-09 02:40:49,Wow...well when @AWRHawkins puts it like that... https://t.co/4iw5gPOXnK,772,,False
1314389860636135427,2020-10-09 02:18:57,UPDATE: Military experts say the details of the sex scandal engulfing North Carolina Democrat senate candidate Cal… https://t.co/iigWeM1LSc,1371,,False
1314384146572226565,2020-10-09 01:56:15,American voters deserve to see three presidential debates--not some Zoom call interview nonsense. https://t.co/UXFQREML1L,2077,,False
1314380820665315328,2020-10-09 01:43:02,RT @joshdcaplan: Twitter Locks Account of Ric Grenell over Voter Fraud Warning https://t.co/9PWjMPJAlU,0,,False
1314380747894124545,2020-10-09 01:42:44,"RT @LibertarianBlue: IMPORTANT story pls share 👇

GOP Sen. Roger Wicker Has Not Scheduled Confirmation Hearing for Trump FCC Nominee Crucia…",0,,False
1314379002396762113,2020-10-09 01:35:48,Naw. https://t.co/Cr39FF31R4,837,,False
1314373816097832966,2020-10-09 01:15:12,"With just 26 days until the election, the radical Left is going to do everything it can. https://t.co/jlaJHbwT81",420,,False
1314368180152864768,2020-10-09 00:52:48,"GOP AGs said Kamala Harris will bring leftist policies to the WH, including the Green New Deal environmentalism and… https://t.co/NdOIABciJT",766,,False
1314362556715274240,2020-10-09 00:30:27,The Democrat Party's North Carolina scandal involving disgraced Democrat Senate candidate Cal Cunningham widens. https://t.co/01OHhnOMbN,643,,False
1314356813903560704,2020-10-09 00:07:38,"In the wake of Kamala Harris getting TROUNCED in front of the nation Wednesday night, Democrats are left to whine a… https://t.co/VIccXw5FC8",1291,,False
1314351002250891272,2020-10-08 23:44:33,Turning a blind eye to crime--THAT'S the Leftist way! https://t.co/4FlENNJuIa,694,,False
1314345818720210950,2020-10-08 23:23:57,"The radical Leftist ""1619 Project"" is such error-filled extremist propaganda that scholars are now calling for the… https://t.co/UtKLgJMxMD",1416,,False
1314340216929480706,2020-10-08 23:01:41,"Where is Joe Biden? Where is Kamala Harris? They are the ""leaders"" of the Democrat Party, so why aren't they leadin… https://t.co/NBajRZpwT8",2192,,False
1314334733451624451,2020-10-08 22:39:54,SHOCK: A Florida high school principal fired for refusing to admit that the Holocaust is a historical fact was rehi… https://t.co/NiqDNyyVKk,394,,False
1314329687712243712,2020-10-08 22:19:51,The Hollywood Reporter has joined the stampede of corporate media outlets using the word “mansplaining” in an appar… https://t.co/W13CUs29Bn,420,,False
1314329374020308992,2020-10-08 22:18:36,RT @AlexMarlow: 3 years after @KeithOlbermann’s show “The Resistance” ended bc he was convinced Trump's removal was imminent... he's back t…,0,,False
1314323998046654471,2020-10-08 21:57:14,WOW. https://t.co/pYWQrhTfqr,1558,,False
1314318149785989120,2020-10-08 21:34:00,"HORROR: A father accused of raping his ten-month-old daughter googled phrases such as, ""How do you know if a baby i… https://t.co/pAsCfVxLWz",616,,False
1314313070664134656,2020-10-08 21:13:49,Listen up Deplorables: https://t.co/guiaQXqmEI,1617,,False
1314306988025749521,2020-10-08 20:49:39,"The National Football League experienced a ten percent drop in TV ratings compared to the 2019 season, according to… https://t.co/uY3LmbP0Xf",380,,False
1314297434873438231,2020-10-08 20:11:41,A Catholic priest has filed a lawsuit against California Gov. Gavin Newsom (D) claiming the governor’s “state of em… https://t.co/IeUHwfMXyI,3651,,False
1314289936170987522,2020-10-08 19:41:53,Military legal experts say Democrat North Carolina Senate candidate Army Reserve Lt. Col. Cal Cunningham’s recently… https://t.co/G5MBfrhMT6,498,,False
1314284593567141891,2020-10-08 19:20:39,Uhhhh... https://t.co/HTnp3TUUN3,222,,False
1314284561073942529,2020-10-08 19:20:32,RT @AlexMarlow: The Democrats are using every dirty trick they have to keep the focus on Trump for the next month and not on their horrible…,0,,False
1314279077780557825,2020-10-08 18:58:44,President Trump has a message to Seniors: https://t.co/fypjwcdHuy,1052,,False
1314277553184669698,2020-10-08 18:52:41,A federal appeals court on Thursday blocked a decision to extend the deadline for counting absentee ballots in batt… https://t.co/NN67sCGxQ1,1017,,False
1314272204410978306,2020-10-08 18:31:26,NOLTE: The blacklisting campaign to destroy Ellen Degeneres appears to be working. Her ratings are down 38 percent… https://t.co/LkPWPUnjtt,882,,False
1314266033927184385,2020-10-08 18:06:55,"President Donald Trump will participate in a virtual rally on the Rush Limbaugh show on Friday, according to an ann… https://t.co/x0mgueCcdQ",1076,,False
1314262693419847681,2020-10-08 17:53:38,The Left has nothing. https://t.co/liaByyWgvG,1317,,False
1314256991221673985,2020-10-08 17:30:59,Tech giant Facebook has announced that it plans to stop running political ads immediately after the election on Nov… https://t.co/2TkAm51zTa,125,,False
1314251738636070914,2020-10-08 17:10:06,"Claim: Vice President Mike Pence said former Vice President Joe Biden is familiar with plagiarism.

Verdict —  True. https://t.co/C4InV55zi3",1281,,False
1314245173153591296,2020-10-08 16:44:01,"NBA star LeBron James and former ESPN host Jemele Hill went lowbrow by calling Vice President Mike Pence “sh*t,” af… https://t.co/FI4JJ4vOcg",415,,False
1314239859289198592,2020-10-08 16:22:54,Speaker of the House Nancy Pelosi (D-CA) hinted at a plan Thursday to remove President Donald Trump from office usi… https://t.co/7QRFMvijdJ,1761,,False
1314234226875736064,2020-10-08 16:00:31,Lol. https://t.co/blbqwX3eHb,368,,False
1314228759780823042,2020-10-08 15:38:48,President Donald Trump’s reelection campaign principal deputy communications director Erin Perrine slammed the Pres… https://t.co/XsZz4RlNnN,869,,False
1314223177325850624,2020-10-08 15:16:37,Senator Ted Cruz (R-TX) on Thursday supported President Donald Trump pushing back against doing a virtual debate wi… https://t.co/lpPGAvpfrq,2891,,False
1314217955832463360,2020-10-08 14:55:52,SOS! https://t.co/IgOYwuJnXB,190,,False
1314212594652082181,2020-10-08 14:34:34,"NOLTE: ""The Washington Post staffer responsible for launching fake news attacks against Brett Kavanaugh, Emma Brown… https://t.co/WvUwdmyUCy",678,,False
1314207443862253569,2020-10-08 14:14:06,Senator Kamala Harris (D-CA) claimed during Wednesday night’s vice-presidential debate that President Donald Trump’… https://t.co/qC1HPhkAV9,307,,False
1314202104265801730,2020-10-08 13:52:53,President Donald Trump warned Thursday that Sen. Kamala Harris was a communist who would quickly seize power if for… https://t.co/zUG9nVrnK5,1572,,False
1314197124620353536,2020-10-08 13:33:05,UPDATE: White House physician Dr. Sean Conley said Tuesday that the president's blood was showing antibodies for CO… https://t.co/yL8PwszqPH,3819,,False
1314191527216852992,2020-10-08 13:10:51,Three Florida polls released on Tuesday showed a wide range of outcomes in the presidential contest between Preside… https://t.co/XRgbeqbtFZ,134,,False
1314186122919112704,2020-10-08 12:49:22,"The number of first-time filers for unemployment benefits fell last week by 9,000 to 840,000. https://t.co/B1xvs4VYoc",366,,False
1314182626660548609,2020-10-08 12:35:29,"TRUMP: ""No, I am not going to waste my time on a virtual debate."" https://t.co/i4BczeECJh",7406,,False
1314181216401321984,2020-10-08 12:29:52,"Kentucky attorney general Daniel Cameron slammed rapper Megan Thee Stallion over her ""disgusting"" comments that Cam… https://t.co/5YlyEbFqMY",460,,False
1314176068258017280,2020-10-08 12:09:25,The second presidential debate between President Donald Trump and Democratic nominee Joe Biden will now be a virtua… https://t.co/rcay9nSDo1,206,,False
1314174948383092736,2020-10-08 12:04:58,China censored Vice President Mike Pence’s criticisms of the country during the vice presidential debate on Wednesd… https://t.co/TfX7wcCJXa,799,,False
1314169520509128707,2020-10-08 11:43:24,Ouch! https://t.co/kmbdc70PeX,1589,,False
1314164102374326272,2020-10-08 11:21:52,The Republican Attorneys General Association (RAGA) is launching a new ad lambasting Sen. Kamala Harris (D-CA) as a… https://t.co/pWdsQkzKZI,793,,False
1314158974963527681,2020-10-08 11:01:30,Dodge of the night! https://t.co/AVyt5bYHM7,2577,,False
1314055997699354624,2020-10-08 04:12:18,"CLAIM: Sen. Kamala Harris (D-CA) claimed that President Donald Trump “instituted, as his first act, a ‘Muslim ban’.… https://t.co/oA11dHoRfv",2444,,False
1314052782194819072,2020-10-08 03:59:31,MSNBC’s Nicolle Wallace gave her immediate reaction to Wednesday’s vice-presidential debate between Sen. Kamala Har… https://t.co/Ifq01i16Il,517,,False
1314049220270317571,2020-10-08 03:45:22,VERDICT: False. https://t.co/xtUUnhBJpM,3049,,False
1314047139014758405,2020-10-08 03:37:06,CLAIM: Vice President Mike Pence claimed that President Donald Trump condemned the neo-Nazis and white supremacists… https://t.co/rDIC1XHPlh,2888,,False
1314043338090262530,2020-10-08 03:22:00,Neither Sen. Kamala Harris (D-CA) nor moderator Susan Page uttered the words “impeach” or “impeachment” during Wedn… https://t.co/Q9amWOioPL,721,,False
1314039878833836032,2020-10-08 03:08:15,America will never forget. https://t.co/690GjI7ueF,2059,,False
1314039156499189761,2020-10-08 03:05:23,Biggest dodge of the night! https://t.co/A9ri98ngl1,2667,,False
1314034406760292355,2020-10-08 02:46:30,Vice President Mike Pence vowed on Wednesday that he and President Donald Trump will hold China accountable for let… https://t.co/sGLnkGyxcU,1657,,False
1314034143433502722,2020-10-08 02:45:28,Ooops! https://t.co/rkceFbozrM,3615,,False
1314033930945933312,2020-10-08 02:44:37,Kamala Harris completely dodged a question about China during her first and only vice presidential debate against V… https://t.co/YdK9rUUbT9,1421,,False
1314029948387110915,2020-10-08 02:28:47,"Sen. Kamala Harris (D-CA) claimed during Wednesday’s vice presidential debate in Salt Lake City, UT, that Democrat… https://t.co/5dN8nr2G4o",447,,False
1314029141570785291,2020-10-08 02:25:35,"Sen. Kamala Harris (D-CA) pledged on Wednesday that, if elected, a Biden administration would revoke President Dona… https://t.co/KI6i7Uszh3",1053,,False
