ID,created_at,text,likes,in reply to,retweeted
1300281903002644480,2020-08-31 03:58:58,Awesome. https://t.co/ZFMsq6Ahsa,2936,,False
1300276699112800257,2020-08-31 03:38:17,"NOLTE: ""Over its four-day convention, Donald Trump and the Republican Party earned 147.9 million viewers and raised… https://t.co/SRaTlAmXKb",1274,,False
1300271119736483840,2020-08-31 03:16:07,An African migrant in court for assaulting a policewoman is said to have assaulted two more police officers while m… https://t.co/uqqsezeVg8,355,,False
1300265989326680071,2020-08-31 02:55:44,"Former Vice President Joe Biden has decided not to visit Kenosha, Wisconsin, the site of recent riots and protests… https://t.co/mMFwiXqb6l",512,,False
1300260426912067586,2020-08-31 02:33:38,"Joe Biden's embarrassingly ineloquent ""deputy campaign manager"" Kate Bedingfield makes a hilarious attempt at pinni… https://t.co/LAPV6Ek4EY",1171,,False
1300255338709635072,2020-08-31 02:13:24,"Rioters in Oakland, California, threw projectiles and shone lasers at police on Saturday night during a violent dem… https://t.co/x5uZwunh2N",399,,False
1300249775758073859,2020-08-31 01:51:18,"The BLM-NFL Green Bay Packers mobilize to begin weaponizing voter registration and ""social justice"" reforms. https://t.co/D3Vxv0Ik0z",294,,False
1300244211040690176,2020-08-31 01:29:11,"Shannon Sharpe, co-host of FS1's Undisputed, says being a black man is the ""hardest job [he's] ever had."" “It’s the… https://t.co/2wzZopEILj",186,,False
1300238827039137794,2020-08-31 01:07:48,Weakness and cluelessness personified. https://t.co/q5XKGbAwWL,725,,False
1300233586839359488,2020-08-31 00:46:58,Here it comes... https://t.co/IRLBJ46A8K,508,,False
1300228343112110080,2020-08-31 00:26:08,"NATIONAL DISGRACE: Joe Biden blamed President Trump for ""incitement"" that he said led to the shooting death of an a… https://t.co/rhLHEERGjG",704,,False
1300223065599733760,2020-08-31 00:05:10,Bill de Blasio's New York City is a horrifying nightmare. https://t.co/iSlR3jpoLF,1238,,False
1300217604808814599,2020-08-30 23:43:28,"Without evidence, multi-millionaire Democrat Party activist and failed postal volunteer Cher declares that a Trump… https://t.co/FnIDLs97AN",642,,False
1300212434188349440,2020-08-30 23:22:55,"Good boy, Titan! https://t.co/Cblvkzreqt",1022,,False
1300206990468186113,2020-08-30 23:01:17,Former San Francisco mayor and California State Assembly speaker Willie Brown wrote Saturday that Democrats should… https://t.co/dLPgNsfCoe,725,,False
1300201725220073473,2020-08-30 22:40:22,It's the oldest political trick in Democrats' playbook: smear your political opponent with the very things you are… https://t.co/ks3pbULL5i,5786,,False
1300196311640268800,2020-08-30 22:18:51,Two officers were wounded early Sunday morning during another shooting in Mayor Lori Lightfoot's Chicago. https://t.co/1Ik3XcmBHo,806,,False
1300191232916893698,2020-08-30 21:58:40,Democrats' unwillingness to crack down on the radical Leftist Mob is astounding. https://t.co/MYpA5pcHYi,1519,,False
1300176407138635777,2020-08-30 20:59:46,Portland Mayor Ted Wheeler declared Sunday afternoon that President Donald Trump was to blame for the violence that… https://t.co/g14RpudO3Q,1819,,False
1300176245288767488,2020-08-30 20:59:07,Former Vice President Joe Biden issued a statement Sunday afternoon in which he blamed President Donald Trump for “… https://t.co/yE3an7p6Lg,292,,False
1300168242812645378,2020-08-30 20:27:19,HORROR: A suspect knocked a woman to the ground on a New York City subway platform in an alleged rape attempt in br… https://t.co/fVShmbYxCA,679,,False
1300163127225573376,2020-08-30 20:07:00,A migrant transport funded by the so-called street artist Banksy demanded help after overloading the vessel with mo… https://t.co/svftBGKWRH,120,,False
1300156811589320706,2020-08-30 19:41:54,ObamaFlix 'Queer Eye' teaming up to bag cash for China Joe's low-energy campaign. https://t.co/EVmPtxhKdO,133,,False
1300144580927643648,2020-08-30 18:53:18,"Former Vice President Joe Biden has decided not to visit Kenosha, Wisconsin, the site of recent riots and protests… https://t.co/7qKjl6fgPZ",1057,,False
1300129957910319106,2020-08-30 17:55:11,RT @tdwilliamsrome: Satanists Vandalize Statue of Jesus in Northern Italy https://t.co/TaosICjtoM via @BreitbartNews,0,,False
1300129929342971904,2020-08-30 17:55:05,RT @IldefonsoOrtiz: Gulf Cartel Member Caught Destroying Surveillance Cameras in Mexican Border City https://t.co/wBe6ek0CIb via @Breitbart…,0,,False
1300128829923565568,2020-08-30 17:50:42,"Sad, but true. https://t.co/NCDgTqu6r1",687,,False
1300128008213323776,2020-08-30 17:47:27,RT @joshdcaplan: Trump Bump After RNC Convention; POTUS Jumps to Lead in National Poll https://t.co/vT8Ip3bjTf,0,,False
1300123293010272256,2020-08-30 17:28:42,"Democrat Party activist and failed postal volunteer Cher declares that a Trump reelection will be the ""end of democ… https://t.co/5bv5Yk2f5Z",713,,False
1300116518362058752,2020-08-30 17:01:47,"NOLTE: ""Over its four-day convention, Donald Trump and the Republican Party earned 147.9 million viewers and raised… https://t.co/l8lWfbVht7",868,,False
1300111377768624128,2020-08-30 16:41:22,Rich BLM-NFL Titans quarterback Ryan Tannehill said that the “United States of America was founded upon racist idea… https://t.co/4qVRt8OIz1,518,,False
1300106165192400896,2020-08-30 16:20:39,"Packers CEO Mark Murphy issued a lengthy statement on Saturday, saying that one of the “keys” in the fight for soci… https://t.co/kVe2DzdzYh",146,,False
1300100745262501888,2020-08-30 15:59:07,Here it comes... https://t.co/yB8Mo9go69,405,,False
1300095351161053184,2020-08-30 15:37:40,It's the oldest political trick in Democrats' playbook: smear your political opponent with the very things you are… https://t.co/seexa5ASLm,2838,,False
1300089856429903877,2020-08-30 15:15:50,"“If you kill one of ours, it’s time for us to kill one of yours.” https://t.co/74wP8kqJer",668,,False
1300084704838914048,2020-08-30 14:55:22,Two officers were wounded early Sunday morning during a shooting in Mayor Lori Lightfoot’s (D) Chicago. https://t.co/6lnQ4Z8Cue,515,,False
1300080383657205760,2020-08-30 14:38:12,***Second Amendment Update*** https://t.co/Ekpq9iL05N,389,,False
1300079273018040324,2020-08-30 14:33:47,A Wisconsin woman upset by the violence in Kenosha launched a recall effort on Friday against Democrat Gov. Tony Ev… https://t.co/qGLX1zYQKx,2709,,False
1300073793071833089,2020-08-30 14:12:01,"The New York Times reported Saturday night that the victim of a deadly shooting in downtown Portland, Oregon, earli… https://t.co/tPBGfhgh5G",490,,False
1300073678160506882,2020-08-30 14:11:33,President Donald Trump on Sunday shared a message on Twitter describing Portland Mayor Ted Wheeler as a “useless fu… https://t.co/NiUHOCzuBk,14927,,False
1300073319740432385,2020-08-30 14:10:08,Walmart has confirmed this week that it is teaming up with tech giant Microsoft in an attempt to purchase the Chine… https://t.co/oUEAEBxwxi,149,,False
1300067848497307648,2020-08-30 13:48:23,Why is China Joe so soft on Communist China? Is it because his son's firm bagged a $1.5 Billion deal with a subsidi… https://t.co/kL4QRXJmIn,887,,False
1300062702233178119,2020-08-30 13:27:56,"Thank you, Border Patrol, for risking your lives to keep Americans safe. https://t.co/gUSCCKhVr0",1372,,False
1300057560528105472,2020-08-30 13:07:30,A retiring Republican congressman from Texas is unsure whether he will vote for President Trump in the November ele… https://t.co/ZstE8Bk8IT,190,,False
1300052233808211968,2020-08-30 12:46:20,"Michael Moore warns Democrats, just like he did in 2016, of the massive Trump Army coming: ""Are you ready for a Tru… https://t.co/6cD9K0MH0P",1175,,False
1300046688866967553,2020-08-30 12:24:18,South African President Cyril Ramaphosa admitted his left-wing African National Congress (ANC) party is “deeply imp… https://t.co/gHiCNfMfUP,361,,False
1300041566107643904,2020-08-30 12:03:57,A federal judge ruled Friday that Texas violated federal law by not allowing residents to register to vote when the… https://t.co/TR8z98ZGPq,245,,False
1300036477972295680,2020-08-30 11:43:44,Uyghur Muslims wearing masks decorated with the flag of their native East Turkestan protested on Friday outside of… https://t.co/E21Lch05k6,356,,False
1300031009279401984,2020-08-30 11:22:00,"Democrats' dour convention stood in sharp contrast to the RNC's forward-looking, optimistic policy vision for rebui… https://t.co/qSW2lqY4yW",545,,False
1300025921764839424,2020-08-30 11:01:47,Leftists radicals wrecked Wisconsin...so Black Trump supporters and Scott Pressler's group are coming together to c… https://t.co/ii15c3iJW2,3007,,False
1299915652803825668,2020-08-30 03:43:37,A Florida Highway Patrol (FHP) K-9 located more than 900 MDMA ( Molly/Ecstasy) pills Friday during a traffic stop i… https://t.co/94zvwijoYF,1318,,False
1299910258626887681,2020-08-30 03:22:11,An anonymous tipster led the police to rescue nearly 80 sick cats from a home in Missouri and arrest two suspects o… https://t.co/z02bh6qME8,422,,False
1299904900516675586,2020-08-30 03:00:54,Joe Biden and Kamala Harris stepped in it. Big time. https://t.co/iqtmqlFo9f,917,,False
1299899640150724609,2020-08-30 02:39:59,"The legal battle between Oracle and Google, which stands accused of stealing technology owned by Oracle for use in… https://t.co/9Wd47i9Enr",169,,False
1299894114876522498,2020-08-30 02:18:02,"President Donald Trump will travel to Kenosha, Wisconsin on Tuesday, according to the White House. https://t.co/KPSlnzf8ja",865,,False
1299893066590031872,2020-08-30 02:13:52,"“wild and out-of-control"" https://t.co/hu3lUA4Gxh",193,,False
1299887714666414082,2020-08-30 01:52:36,Working class Americans have had enough of the radical Mob's rioting and looting. And they're ready to roar come No… https://t.co/6Td8r1IOtB,1628,,False
1299882197470580737,2020-08-30 01:30:41,A new ad by Joe Biden’s campaign is attempting to place the blame on Donald Trump for a decision Michigan Gov. Gret… https://t.co/Hj3t0mATLU,459,,False
1299876921220751362,2020-08-30 01:09:43,Outstanding idea! Rich Hollywood Elites should vow to go and stay on strike for at least 5 years! https://t.co/AQYtYf6Qz5,2888,,False
1299872126787297280,2020-08-30 00:50:40,So the woman who admitted the first time as an adult that she was proud of America is when her husband won the pres… https://t.co/DQzqG3XHab,1271,,False
1299847450627313664,2020-08-29 23:12:36,"BLM activists held a Black National Convention Friday, which aimed to “reach and engage four million Black voters a… https://t.co/8Kq3ntIOss",108,,False
1299842057440317442,2020-08-29 22:51:11,So the woman who admitted the first time as an adult that she was proud of America is when her husband won the pres… https://t.co/2lG2HWspql,3128,,False
1299836576424394754,2020-08-29 22:29:24,Portland Mayor Ted Wheeler is a shining example of Democrat Party leadership and policy brilliance! https://t.co/TOTq0DYafT,1235,,False
1299815999974375424,2020-08-29 21:07:38,South African President Cyril Ramaphosa admitted his left-wing African National Congress (ANC) party is “deeply imp… https://t.co/HuWqL3lser,421,,False
1299810713683320844,2020-08-29 20:46:38,"The true number of coronavirus cases in Syria ""far exceed[s] official figures"" confirmed by the government, a senio… https://t.co/gCypkvbtWF",132,,False
1299808148228837377,2020-08-29 20:36:26,"RT @NolteNC: ""Even Neville Chamberlain condemned the invasion of Poland.""

https://t.co/W7rSmJWXbu via @BreitbartNews",0,,False
1299805312581500929,2020-08-29 20:25:10,Joe Biden and Kamala Harris stepped in it. Big time. https://t.co/AQ99R6dnqN,587,,False
1299800044263092224,2020-08-29 20:04:14,We love our police! https://t.co/A2ADuc7hPq,4040,,False
1299793952728588289,2020-08-29 19:40:01,"As Leftist riot, American Citizens are buying more guns to protect their families. https://t.co/opD0hULWZP",1264,,False
1299788788311494660,2020-08-29 19:19:30,"President Donald Trump said he's looking into the shooting of Jacob Blake: ""It was not a good sight. I didn't like… https://t.co/klFWQKZZzv",403,,False
1299783149342392320,2020-08-29 18:57:06,THIS is the Radical Left. https://t.co/1AzhZHJHZL,2363,,False
1299777348372492288,2020-08-29 18:34:03,Leftists are FURIOUS that the RNC defied their absurd and wrongheaded stereotypes by showcasing the full spectrum o… https://t.co/OjMDOYCbKQ,1187,,False
1299771727380189192,2020-08-29 18:11:43,Well THAT's an understatement! https://t.co/sg24DPM5yc,1052,,False
1299766663412363265,2020-08-29 17:51:35,And here's the 'Baby Lives Matter' mural... https://t.co/APoaUfj72b,791,,False
1299761121071685632,2020-08-29 17:29:34,A 20-year-old Christian man was beaten to death in eastern Uganda by family members for leaving Islam and convertin… https://t.co/rW8xntXjvf,477,,False
1299755743583916038,2020-08-29 17:08:12,Outstanding idea! Rich Hollywood Elites should vow to go and stay on strike for at least 5 years! https://t.co/04b4ELjeoR,3584,,False
1299750227612700673,2020-08-29 16:46:17,Working class Americans have had enough of the radical Mob's rioting and looting. And they're ready to roar come No… https://t.co/9FEkc6i0E8,1160,,False
1299745105121890307,2020-08-29 16:25:55,The BLM rioters and Leftist looters have energized and fired up the giant Silent Majority for November 3rd!  Bikers… https://t.co/vyxbd2SAsu,1309,,False
1299738683906678785,2020-08-29 16:00:24,Trump slammed Joe Biden during the RNC for taking the donations of American workers while helping to offshore their… https://t.co/DJ6jMObbBv,785,,False
1299733207739441153,2020-08-29 15:38:39,"Spike Lee: ""Are we coming to a civil war?"" https://t.co/oPMQWkY2K0",601,,False
1299728061240410117,2020-08-29 15:18:12,"The nightly violent Antifa riots in Portland have created a backlog of calls for help, including reports of gunfire… https://t.co/7RsyBGvlEL",395,,False
1299722870923427841,2020-08-29 14:57:34,FACT CHECK CLAIM: President Donald Trump says he helped stop a number of Tennessee Valley Authority (TVA) workers f… https://t.co/I7snE6Lizl,1193,,False
1299717322635177984,2020-08-29 14:35:31,Lie. https://t.co/BtuPkEyqER,1715,,False
1299711701059809284,2020-08-29 14:13:11,"Chinese state media on Friday claimed the People’s Liberation Army Navy (PLAN) “expelled” an American destroyer, th… https://t.co/szOYNll6PD",127,,False
1299706410687758337,2020-08-29 13:52:10,Multi-Millionaire athletes rush to weaponize their BLM-NFL political activism. https://t.co/D2Gx9iKBRt,1412,,False
1299701085108658179,2020-08-29 13:31:00,"Brazil’s top federal court, the Superior Court of Justice (STJ), removed Rio de Janeiro Gov. Wilson Witzel from his… https://t.co/cLHHH5Qtsz",261,,False
1299695884133949442,2020-08-29 13:10:20,Facebook has threatened to blacklist the page of conservative comedy duo Kevin Hodge and Keith Hodge on the same da… https://t.co/7tfeMwyT1Y,5718,,False
1299690770073608192,2020-08-29 12:50:01,"Activists vandalized the home of LAPD Chief Michael Moore, allegedly destroying a lantern and leaving posters stuck… https://t.co/YEq0pUiy3v",309,,False
1299685272968474625,2020-08-29 12:28:10,"President Trump: ""In a second term, I will expand charter schools and provide school choice to every family in Amer… https://t.co/K6MyFHZTMm",909,,False
1299679813981143040,2020-08-29 12:06:29,"Utah Attorney General Sean Reyes spoke at the RNC on Thursday, proclaiming that ""President Trump is a warrior again… https://t.co/rlXHWBPvhS",1265,,False
1299674286165291008,2020-08-29 11:44:31,Chinese Foreign Minister Wang Yi arrived in Europe for a “charm offensive” this week but found himself shadowed by… https://t.co/9rNA0jbQjJ,950,,False
1299668829363150848,2020-08-29 11:22:50,Vice President Mike Pence said during a campaign event on Friday that former Vice President Joe Biden would “stifle… https://t.co/1mmN06aVDH,630,,False
1299663261353283585,2020-08-29 11:00:42,The Department of Justice announced on Thursday that it will prosecute 74 people for crimes committed during violen… https://t.co/UACx8QT8xX,2212,,False
1299556621136343040,2020-08-29 03:56:57,"The true number of coronavirus cases in Syria “far exceed[s] official figures” confirmed by the government, a senio… https://t.co/JZHeZibrIn",99,,False
1299551075817660416,2020-08-29 03:34:55,MSNBC is a de facto advertising arm of the Biden campaign. https://t.co/aq0utTG5Oz,663,,False
1299545476786774016,2020-08-29 03:12:40,"Bellevue, Washington, police announced 46 people have been arrested or charged in connection to looting during May'… https://t.co/z4SC4izoYH",1429,,False
1299540054344429568,2020-08-29 02:51:07,"New York Times is freaking out about how highly engaged YOU--Breitbart Nation-- are right here, despite Big Tech su… https://t.co/Ya6IAGbgqc",1089,,False
1299534825297248262,2020-08-29 02:30:21,Fearless. Unafraid. And proud of his country and President. https://t.co/XUqL1Z1aml,1978,,False
1299529461663256576,2020-08-29 02:09:02,Good riddance! Losers flock together! https://t.co/UOXdkCINGa,916,,False
1299526761080913920,2020-08-29 01:58:18,"RT @SarahPalinUSA: Humbled and thankful. 
https://t.co/iPHMchWBhv",0,,False
1299523927992131584,2020-08-29 01:47:03,"Shannon Sharpe, co-host of FS1’s Undisputed, has proclaimed that being a black man is the “hardest job [he’s] ever… https://t.co/XzIqZd8NJ7",217,,False
1299518641763954689,2020-08-29 01:26:02,"NOLTE: ""Obviously frustrated over the success of the RNC, the media are now fabricating a scandal to attack Preside… https://t.co/b7iZvtJsiD",2987,,False
1299513047527174144,2020-08-29 01:03:48,And the award for 'Most Bitter Presidential Loser in American History' goes to... https://t.co/SOcoOH5nHq,4931,,False
1299507470264676352,2020-08-29 00:41:39,"Well, well, well...would you look at that! https://t.co/f0R68ojZxP",734,,False
1299502260179869698,2020-08-29 00:20:57,Justice 4 Jussie! https://t.co/WCkrztTn5B,316,,False
1299496763984932866,2020-08-28 23:59:06,"The 4-day RNC was, in a word, spectacular. Which is why Rich Entertainment Elites are FREAKING OUT. https://t.co/QgumpuNm7t",683,,False
1299491418898137097,2020-08-28 23:37:52,Joe Biden could have condemned Leftist violence during his DNC acceptance speech. He refused to do so. The Silent M… https://t.co/tlpInISXCA,3920,,False
1299485681350311937,2020-08-28 23:15:04,Multi-Millionaire Leftist Elite Jim Gaffigan experienced a nuclear-grade meltdown on the final day of the RNC with… https://t.co/gkKvEmjbVI,845,,False
1299480238968262656,2020-08-28 22:53:26,The BLM-NBA goes all in https://t.co/eblff7aooo,267,,False
1299475064010739713,2020-08-28 22:32:52,"***Live Updates*** 

Trump Holds New Hampshire Rally https://t.co/BfNuQp9NLt",393,,False
1299468108135116808,2020-08-28 22:05:14,"Alice Johnson, who was pardoned for a nonviolent drug crime, said God's grace and President Trump's compassion are… https://t.co/BGRpanNrka",779,,False
1299462426006564864,2020-08-28 21:42:39,Donald Trump said he has done more for the black community than Joe Biden has done in his 47 years in politics. https://t.co/EwVNyRQMI0,1700,,False
1299454707799404544,2020-08-28 21:11:59,"19 VIDEOS: Protesters harassed people in the streets of Washington, DC, following the last night of the Republican… https://t.co/sChD74wiXX",497,,False
1299449303086370816,2020-08-28 20:50:31,You CANNOT make this garbage up! https://t.co/2TiwtMmqZT,1329,,False
1299443109470896128,2020-08-28 20:25:54,RT @RAMansour: 19 Videos of Left-Wing Protesters Harassing People After the Republican National Convention https://t.co/JhYwgv5QqK via @Bre…,0,,False
1299436202253221892,2020-08-28 19:58:27,Vice President @Mike_Pence said at a campaign event on Friday afternoon that President Donald Trump stands with Min… https://t.co/5EOTFFDatn,556,,False
1299425339110821888,2020-08-28 19:15:17,"Bellevue, Washington, police announced Thursday that 46 individuals have been arrested or were charged in connectio… https://t.co/HkP3mjI2AU",1159,,False
1299419291851390977,2020-08-28 18:51:15,"New York Times is freaking out about how highly engaged YOU--Breitbart Nation-- are right here, despite Big Tech su… https://t.co/7rryXEHwxN",1239,,False
1299405116206972931,2020-08-28 17:54:56,"RT @AlexMarlow: Oh no… please… don’t…
https://t.co/csieyYzChn",0,,False
1299403169286574083,2020-08-28 17:47:11,Representatives of the U.S. Bishops’ conference (USCCB) have condemned the violent methods of Kenosha rioters and l… https://t.co/43bLxCeMD8,312,,False
1299397998972219392,2020-08-28 17:26:39,Hollywood elites were triggered following President Donald Trump’s acceptance speech Thursday and perhaps none more… https://t.co/AhjOCKpzmX,1214,,False
1299391242699235335,2020-08-28 16:59:48,"Pat Lynch, president of the New York City Police Benevolent Association, the largest municipal police union in the… https://t.co/3gPfXaBfPU",863,,False
1299385976989548546,2020-08-28 16:38:52,Vegas forward Ryan Reaves was struggling with the decision of whether to sit out the Golden Knights’ playoff game t… https://t.co/G5vgfI7DNe,71,,False
1299380542761205760,2020-08-28 16:17:17,NOLTE:  A study shows nearly 12 percent of Republicans say they would not give an honest opinion to a pollster. The… https://t.co/lfoHu4aJdl,485,,False
1299374940790063104,2020-08-28 15:55:01,".@RepJimBanks (R-IN) is introducing legislation this week, Breitbart News has learned, to strip convicted rioters o… https://t.co/joO0yTElMw",4088,,False
1299371773201469440,2020-08-28 15:42:26,Clear contrast. https://t.co/opl3NYQ3uL,539,,False
1299369752343830528,2020-08-28 15:34:24,RT @joelpollak: The criminal complaint against Kyle Rittenhouse includes all sorts of exculpatory detail for everything except the last cou…,0,,False
1299366378361761793,2020-08-28 15:21:00,C-SPAN said Trump's 70-minute speech at the RNC was among the longest; Biden's 24.5-minute speech at the DNC was am… https://t.co/J8xAGjycFb,842,,False
1299359702908841984,2020-08-28 14:54:28,Don't let her power and wealth fool you...Michelle Obama is a victim... NOT. https://t.co/lBc1oATY5T,3092,,False
1299354632519667713,2020-08-28 14:34:19,The Left can't win rational arguments and debates. So they do this instead: https://t.co/qHRKrTbBOg,369,,False
1299348937552396288,2020-08-28 14:11:42,"The 4-day RNC was, in a word, spectacular. Which is why Rich Entertainment Elites are FREAKING OUT. https://t.co/B6n72bSgMI",1020,,False
1299343428959035392,2020-08-28 13:49:48,WOW https://t.co/zAbxrpnEUM,574,,False
1299342306475204608,2020-08-28 13:45:21,Secretary of State Mike Pompeo wrapped up his trip to the Middle East and Sudan with a stop in Oman on Thursday to… https://t.co/MPshZVJaH5,247,,False
1299336970364235776,2020-08-28 13:24:08,God Bless Ann Dorn. https://t.co/qqs9w2w9Ju,3027,,False
1299330647803203585,2020-08-28 12:59:01,The Mob is out of control. https://t.co/3iR6QnDxqa,7469,,False
1299327322525491200,2020-08-28 12:45:48,"During his speech to the Republican National Convention (RNC) on Thursday, Rudy Giuliani issued a warning to the co… https://t.co/bhFo6H8JlQ",7303,,False
1299322018840678401,2020-08-28 12:24:44,"President Trump drew a stark contrast between his view of America and that of the Democrats, affirming the American… https://t.co/AAcONf0mKX",873,,False
1299316750220173313,2020-08-28 12:03:48,"Civil rights leader Clarence Henderson: ""If you vote for Biden, 'you don't know history.'"" https://t.co/s0a3dSKFM9",2123,,False
1299311590311964672,2020-08-28 11:43:17,A homicide suspect committed suicide. So... https://t.co/CYcEZlO6R6,412,,False
1299306419351678977,2020-08-28 11:22:44,"R&amp;B singer R. Kelly was attacked by an inmate in a Chicago prison, according to his attorney. https://t.co/wq9WDPsd8w",349,,False
1299300982195736577,2020-08-28 11:01:08,MLB backwards is BLM! Multi-millionaires skip work. https://t.co/7GkAGd1bu5,383,,False
1299194571570712578,2020-08-28 03:58:18,"UFC President Dana White: “Let’s talk about COVID, and let’s be very honest about it. No one person and no one plac… https://t.co/N2wlUhtepw",1834,,False
1299188784026783749,2020-08-28 03:35:18,"Protesters put a guillotine in front of the White House with a doll resembling President Trump in it, as the presid… https://t.co/pv3w16oSKp",218,,False
1299188108148256768,2020-08-28 03:32:37,"CLAIM: “How can Joe Biden claim to be an ‘ally of the Light’ when his own party can’t even keep the lights on?”

VE… https://t.co/c5Gh5iIE7g",445,,False
1299186557426036736,2020-08-28 03:26:27,Protesters surrounding the White House on Thursday evening assaulted an elderly couple walking on the street nearby. https://t.co/DN9pg1Yhai,467,,False
1299185232613117952,2020-08-28 03:21:11,Sen. @TomCottonAR said during the Republican National Convention (RNC) that former Vice President Joe Biden “aided… https://t.co/y8EJ3wizyp,654,,False
1299184414317064198,2020-08-28 03:17:56,"RT @AlexMarlow: Fact Check: True
https://t.co/brxtBj2VRa",0,,False
1299182005234565121,2020-08-28 03:08:22,President Donald Trump drew laughter from the audience on the South Lawn of the White House on Thursday evening as… https://t.co/wcEZd4XX2d,1042,,False
1299177907257053184,2020-08-28 02:52:05,"RT @AlexMarlow: “I have done more in three years for the black community than Joe Biden has done in 47 years.” -@realDonaldTrump 

You have…",0,,False
1299177168992448513,2020-08-28 02:49:09,President Donald Trump’s daughter and Senior Adviser Ivanka Trump introduced her father on the final night of the R… https://t.co/EcBeTqN08N,917,,False
1299173555545010176,2020-08-28 02:34:47,Sen. @TomCottonAR said during the Republican National Convention (RNC) on Thursday evening that President Donald Tr… https://t.co/dDyXodb9RA,583,,False
