ID,created_at,text,likes,in reply to,retweeted
1307005482515795970,2020-09-18 17:16:04,"RT @AlexMarlow: AP: “Trump downplays legacy of slavery in appeal to white voters”

The Democrats are simultaneously arguing that:

a) Ameri…",0,,False
1307001283350605824,2020-09-18 16:59:23,"Staffing shortages are leading to a delay in in-person learning once again in New York City, said Mayor Bill de Bla… https://t.co/UUnxYcsvRa",134,,False
1306996068173967361,2020-09-18 16:38:40,President Donald Trump reached a 53 percent job approval rating on Friday — a figure not seen since House Speaker N… https://t.co/v6lMUyx996,1692,,False
1306990898014752768,2020-09-18 16:18:07,The San Francisco archbishop is urging Catholics to “Free the Mass” and publicly demonstrate against the coronaviru… https://t.co/LSolGnUgAO,842,,False
1306985723522953216,2020-09-18 15:57:33,Clown. https://t.co/CaDYdNKESP,557,,False
1306980163331252225,2020-09-18 15:35:28,Prime Minister Boris Johnson has suggested U.S. presidential hopeful Joe Biden does not understand Britain’s negoti… https://t.co/Nmy5xrVUuh,908,,False
1306974884271095822,2020-09-18 15:14:29,"The FN 509 Midsize is an accurate, flawlessly reliable 9mm pistol which is made in Columbia, South Carolina, by FN… https://t.co/c4ODX4N9cR",455,,False
1306969752246444037,2020-09-18 14:54:05,Donald Trump and Joe Biden are virtually tied in a critical poll about the presidential election—and have been for… https://t.co/Pk9wu0aliz,216,,False
1306964658461593600,2020-09-18 14:33:51,Get the facts from @AWRHawkins  👇 https://t.co/kynNO6H2Pu,173,,False
1306958874205999104,2020-09-18 14:10:52,Harvey Weinstein is no longer an honorary Commander of the British Empire. The Queen stripped the disgraced former… https://t.co/e8YJa6Tkht,826,,False
1306956962882441225,2020-09-18 14:03:16,LIVE: Trump supporters lining up ahead of today's Minnesota rally... https://t.co/WdW975QMpA,1448,,False
1306953708706594822,2020-09-18 13:50:20,Why is Joe Biden so soft and friendly toward Communist China? Just ask Hunter Biden and Rosemont Seneca. https://t.co/rvs8xY1RXF,849,,False
1306948674589724672,2020-09-18 13:30:20,A recently resurfaced video shows John Kerry lecturing on the impossibilities of achieving what the Trump administr… https://t.co/9t1wv2VRUs,2861,,False
1306943252889833476,2020-09-18 13:08:47,"When Neil Bradley got his start in politics working for Rep. Tom Coburn, he was known as a sort of whiz-kid exposin… https://t.co/VyiIl1b8zW",102,,False
1306937739791732736,2020-09-18 12:46:53,HORROR: Police are investigating after a man allegedly dismembered his girlfriend then traveled to Chicago with som… https://t.co/J8vR9gz6lY,390,,False
1306932534836682757,2020-09-18 12:26:12,The New Republic is facing backlash after it drew a comparison between Sen. Joni Ernst’s (R-IA) “abusive husband” a… https://t.co/IiC3zqF3Tj,152,,False
1306926994874138625,2020-09-18 12:04:11,The Pennsylvania Supreme Court’s decision to kick the Green Party’s White House candidate off the 2020 ballot could… https://t.co/79XjO9IlF3,166,,False
1306921603838750720,2020-09-18 11:42:46,"When Neil Bradley got his start in politics working for Rep. Tom Coburn (R-OK), he was known as a sort of whiz-kid… https://t.co/5FhntiELpm",135,,False
1306916255534850053,2020-09-18 11:21:31,"Far-left radicals will be able to push Joe Biden (D) in a “more progressive direction,” Rep. Alexandria Ocasio-Cort… https://t.co/ZYWSPtvtqk",451,,False
1306911199813079040,2020-09-18 11:01:25,A now-deceased suspect of a brutal homicide in Seattle is reportedly a repeat offender who has been booked at least… https://t.co/tGNwKZdnCL,915,,False
1306800309591736320,2020-09-18 03:40:47,Nike has decided to commemorate the four-year anniversary of when Colin Kaepernick first knelt during the national… https://t.co/5YXrPEblph,398,,False
1306795093488209926,2020-09-18 03:20:04,Amazing! https://t.co/oKaBnnsxui,5741,,False
1306791755262689285,2020-09-18 03:06:48,President Donald Trump on Thursday warned that Sen. Kamala Harris might become the President of the United States i… https://t.co/e4Uv7sbRaK,856,,False
1306790835434946561,2020-09-18 03:03:08,"President Donald Trump ridiculed House Speaker Nancy Pelosi on Thursday for visiting a hair salon without a mask, b… https://t.co/m6cOCPaQq5",895,,False
1306788381461024771,2020-09-18 02:53:23,Supporters of President Donald Trump on Thursday chanted “Nobel Peace Prize!” as he campaigned in Wisconsin. https://t.co/LWy7PZ9LIo,1208,,False
1306782878219620354,2020-09-18 02:31:31,President Trump warned that a Joe Biden administration will let “Crazy Beto” destroy the Second Amendment. https://t.co/5uogzHOQy0,950,,False
1306778549513224192,2020-09-18 02:14:19,FRAUD https://t.co/wxeiUMjfHO,2278,,False
1306775176961495040,2020-09-18 02:00:55,Joe Biden said that he doesn’t think that the Green New Deal is “too much” https://t.co/GfxoWNDggQ,331,,False
1306770516993282049,2020-09-18 01:42:24,THIS is China Joe. https://t.co/Uniio8TtpR,573,,False
1306769248988127232,2020-09-18 01:37:22,Watch Live: Donald Trump Hosts Campaign Rally in Wisconsin https://t.co/zf01Ft1qIp,613,,False
1306765302424834051,2020-09-18 01:21:41,Joe Biden stated that he would have the authority as president to have a mask mandate on federal property and land… https://t.co/iRFw9eBbCC,395,,False
1306761331660423176,2020-09-18 01:05:54,Open Borders Joe. https://t.co/Nn21NEvXt9,639,,False
1306756171555115012,2020-09-18 00:45:24,***Live Updates*** Trump Holds Wisconsin Rally https://t.co/w8NLN7K56h,411,,False
1306755771858931712,2020-09-18 00:43:49,The Chinese Communist Party (CCP) mouthpiece Global Times on Wednesday accused Australia’s government of “McCarthyi… https://t.co/bL3d84Xwds,286,,False
1306750230445150214,2020-09-18 00:21:47,"RT @RepJimBanks: The #CCP disinformation campaign targets our classrooms, our news outlets, our social media platforms—they even want to ou…",0,,False
1306747183115501569,2020-09-18 00:09:41,🇺🇸🇺🇸🇺🇸🇺🇸🇺🇸🇺🇸🇺🇸🇺🇸 https://t.co/WPJJSkR62z,1541,,False
1306741885734658048,2020-09-17 23:48:38,Four voters who claimed the National Public Radio (NPR) West headquarters as their residence and voted in 2018 via… https://t.co/3dAcdbpJmH,672,,False
1306740471604146176,2020-09-17 23:43:01,RT @LibertarianBlue: Wikipedia Editors Censor Portland Murder from Antifa Page https://t.co/aQ0OIomNfJ via @BreitbartNews,0,,False
1306736452659802112,2020-09-17 23:27:02,"Two campaign team members for Republican Lacy Johnson, challenger to Rep. Ilhan Omar, were shot in Minneapolis, one… https://t.co/VEeTBskYxA",795,,False
1306730822800740352,2020-09-17 23:04:40,"REVEALED: A massive network of well funded left-wing activists and progressive groups are training, organizing, and… https://t.co/MdBLqGHoBy",4328,,False
1306725690558099457,2020-09-17 22:44:17,A Rasmussen Reports poll released Thursday finds large majorities of black and other minority likely U.S. voters ar… https://t.co/5YwhKm2zyi,1022,,False
1306720466107858951,2020-09-17 22:23:31,BOMBSHELL: Democrat Nashville Mayor John Cooper hid data on coronavirus infections emerging from area bars and rest… https://t.co/NQq9xF9XKY,5854,,False
1306715000153743360,2020-09-17 22:01:48,UPDATE: Fox News Channel's Harris Faulkner issued a bizarre statement Thursday regarding Newt Gingrich being chasti… https://t.co/5W7aLQBJH5,2009,,False
1306712555449188357,2020-09-17 21:52:05,".@JoeBiden: ""You know, there's that great philosopher, and he talked about, Jill puts notes up on my mirror when sh… https://t.co/DimqHSMsBh",1586,,False
1306697665988775942,2020-09-17 20:52:55,ICYMI https://t.co/9NsD3ECpTw,160,,False
1306691696529412103,2020-09-17 20:29:12,Terrible. https://t.co/bVfgRxLaUP,222,,False
1306686097255260161,2020-09-17 20:06:57,Sad Willard strikes again. https://t.co/82my65dIOE,548,,False
1306680861031620610,2020-09-17 19:46:08,Over one-third of Florida voters indicated that they will cast their ballot for November's presidential election by… https://t.co/bRFv2OLVZn,140,,False
1306675576535683076,2020-09-17 19:25:08,President Donald Trump said on Thursday that states sending unsolicited mail-in ballots should end the process to p… https://t.co/GDCgAYw7er,419,,False
1306669897712373760,2020-09-17 19:02:35,Pennsylvania’s highest court gave the Democratic Party a series of victories Thursday. https://t.co/DHDQMZosVd,71,,False
1306668686670024711,2020-09-17 18:57:46,Sen. @KLoeffler told Breitbart News that it is “disgusting” that vice presidential nominee Sen. Kamala Harris has y… https://t.co/ukSgDnkzgu,762,,False
1306666378066264067,2020-09-17 18:48:35,FACT CHECK CLAIM: Joe Biden and actress Eva Longoria told a Florida audience on Tuesday that President Trump locked… https://t.co/0FySDOAAmc,2029,,False
1306664051611709440,2020-09-17 18:39:21,".@KamalaHarris: ""One of the biggest dilemmas for any of us as a parent is what to do about our kids in school... We… https://t.co/e89pP88TBU",883,,False
1306660975697965057,2020-09-17 18:27:07,"Homebuilder confidence soared to record high in September as low mortgage rates, locked down amenities, rising crim… https://t.co/DvFZMpiN29",164,,False
1306655599581638660,2020-09-17 18:05:46,Civil Rights Commissioner Peter Kirsanow said the “1619 Project” is “one of the most significant attempts to propag… https://t.co/1WcE3NNTAb,617,,False
1306649947723493377,2020-09-17 17:43:18,Greasy Crony Capitalists on Wall St. are salivating at the thought of getting back to the old Obama-Biden Swamp Dea… https://t.co/UDniokfiiN,317,,False
1306648424817799168,2020-09-17 17:37:15,".@SpeakerPelosi says looting, arson, and rioting ""should be prosecuted. That is lawlessness."" https://t.co/WF3SVXSwha",3357,,False
1306644355046879233,2020-09-17 17:21:05,Former California governor Arnold Schwarzenegger on Thursday deemed the global coronavirus crisis a “tremendous opp… https://t.co/0zWVTrjT8v,158,,False
1306639446595469313,2020-09-17 17:01:34,"RT @AWRHawkins: James Lee Carr ID'd, Arrested for Allegedly Shooting Federal Officer ⁦@BreitbartNews⁩ #2A  https://t.co/eGk7HCmMhE",0,,False
1306638786361806851,2020-09-17 16:58:57,Democrat New York City Mayor Bill de Blasio announced he will furlough himself and his entire staff in the midst of… https://t.co/TCKbbN0FrH,380,,False
1306633575119425537,2020-09-17 16:38:15,"Former President Barack Obama announced Thursday he had finished volume one of his memoirs, all 768 pages of it. https://t.co/CvjOXLcc8a",640,,False
1306628256452562945,2020-09-17 16:17:06,"In an escalation in the battle over Netflix’s Cuties, @RepDougCollins is asking the Federal Communications Commissi… https://t.co/Zq2CCXB0ue",880,,False
1306625340182278145,2020-09-17 16:05:31,More bad news for Leftists. https://t.co/5EpBvAZBwY,368,,False
1306619945745252354,2020-09-17 15:44:05,Attorney General William Barr reportedly asked federal prosecutors to explore whether Seattle Mayor Jenny Durkan (D… https://t.co/hytTSKLzx3,4965,,False
1306614408878206980,2020-09-17 15:22:05,Kanye West has been suspended from Twitter for posting the phone number of a Forbes editor shortly after posting im… https://t.co/InnTqB4jX2,307,,False
1306608850699722755,2020-09-17 15:00:00,New York City public schools will not open for in-person classes as planned on Monday. https://t.co/3ZbEDBouB0,158,,False
1306607522996985856,2020-09-17 14:54:43,RT @carney: Flight from the Cities: Single Family Housing Starts Boom in August https://t.co/cqsEfkTUsM via @BreitbartNews,0,,False
1306604039107416065,2020-09-17 14:40:53,Fox News cut off Newt Gingrich after he brought up the role of billionaire left-wing financier George Soros in fund… https://t.co/0fSGV5CkVL,10259,,False
1306598724119015424,2020-09-17 14:19:45,Separated at birth? https://t.co/vulQBtp6jk,318,,False
1306593357360103424,2020-09-17 13:58:26,"The suspect, 30-year-old Isaiah Cantrell, said that he destroyed the 90-year-old statue because Jesus’s skin color… https://t.co/bQBLl2CRMv",767,,False
1306587874863837184,2020-09-17 13:36:39,"Yeah, yeah, yeah...but will anything actually HAPPEN to Jim Comey? Or is it just more political grandstanding? Amer… https://t.co/T5OkaDoe5P",2211,,False
1306582338583789574,2020-09-17 13:14:39,New claims for unemployment insurance fell by slightly more than expected last week. https://t.co/4DQrd8ry8T,195,,False
1306578899267133440,2020-09-17 13:00:59,Typical Leftist move. https://t.co/Dc8wtmfPrN,735,,False
1306573779171188736,2020-09-17 12:40:38,"HORROR: Three brothers, two of whom are illegal aliens, stand accused of raping a 10-year-old girl in Kenner, Louis… https://t.co/iyDeyzBoPo",770,,False
1306564528717664260,2020-09-17 12:03:53,"President Donald Trump disputed testimony from CDC Director Robert Redfield to Congress on Wednesday, saying that h… https://t.co/EfM0d0AAou",366,,False
1306559397347430401,2020-09-17 11:43:29,Connecticut Gov. Ned Lamont (D) released his 70th executive order related to the coronavirus Tuesday by announcing… https://t.co/plyMvL5lI3,912,,False
1306553925802307584,2020-09-17 11:21:45,VILE https://t.co/bE2rhOHcPH,800,,False
1306548819400818694,2020-09-17 11:01:27,“It’s very ironic that they are using those tools that we’ve seen throughout much of the 20th century employed in s… https://t.co/BZLh5ScoLs,394,,False
1306440052482940929,2020-09-17 03:49:15,"Dr. Redfield testified: ""if I don’t get an immune response, the vaccine is not going to protect me. This face mask… https://t.co/yxK6f7srQ9",330,,False
1306434531537321984,2020-09-17 03:27:19,Joe Biden compared President Donald Trump to the late Cuban dictator Fidel Castro on Tuesday during a campaign swin… https://t.co/BbN366EZzA,510,,False
1306429018724540416,2020-09-17 03:05:24,"The pro-communist China group, the Chinese Progressive Association (CPA) in San Francisco, is actively funding a ve… https://t.co/3kWyglVgSj",700,,False
1306426539081437184,2020-09-17 02:55:33,RT @kristina_wong: Exclusive: Nearly 800 Military Family Members Sign Pro-Trump Letter https://t.co/rojrMt5laE via @BreitbartNews,0,,False
1306423668642320384,2020-09-17 02:44:09,"https://t.co/uwSgd6Zpwb ""It feels like there is a lot of quid pro quos involved in this, that it isn’t something la… https://t.co/99ezheSTDT",113,,False
1306418044412010497,2020-09-17 02:21:48,Peter Strzok remains a true believer. https://t.co/Mct3MFLU0o,320,,False
1306412906397999104,2020-09-17 02:01:23,"The far-Left publication The Nation observes that Trump is consolidating support, even from “Biden Republicans.” https://t.co/N8uORej6AC",1035,,False
1306407593280241664,2020-09-17 01:40:16,"Arte Moreno, the owner of the Los Angeles Angels, told a gathering of Latino voters that it is “very necessary to v… https://t.co/pdfSnmwn7e",5787,,False
1306402218409684992,2020-09-17 01:18:55,"""15 days to slow the spread,"" we said. https://t.co/00enzZ16Sm",328,,False
1306396560083820545,2020-09-17 00:56:26,A Massachusetts man installed an electric fence around the Trump 2020 sign in his front yard to keep potential thie… https://t.co/fgp7BDJXKv,1274,,False
1306390980225110016,2020-09-17 00:34:15,"Jocelyn Benson, who has endorsed President Trump’s rival Joe Biden and spoke at the DNC, made the apparent error. T… https://t.co/o0jQfBhXUn",1079,,False
1306385823001186311,2020-09-17 00:13:46,"Andrew Beattie of Delhi Township, Ohio, showed off his own social-distancing solution for this year’s hopeful trick… https://t.co/gQkCpYNmAg",411,,False
1306380525716807680,2020-09-16 23:52:43,Former Chicago Bears coach Mike Ditka has reiterated his disgust over NFL players who protest during the national a… https://t.co/4mXDJ62uRC,3055,,False
1306375429113237504,2020-09-16 23:32:28,.@KanyeWest: “I forgive everyone from the music industry that is involved with modern-day slavery. Vengeance is onl… https://t.co/hqJworBdKx,797,,False
1306369666714042368,2020-09-16 23:09:34,"“Go to another country and play football there,” Mike Ditka said of the NFL players protesting the national anthem. https://t.co/PqiRSqnLTI",10109,,False
1306364439185195009,2020-09-16 22:48:48,"Over 7,000 Texas Deplorables fire up the ""Laredo Trump Train""! https://t.co/iKbMRsx1tS",5589,,False
1306358980915146753,2020-09-16 22:27:06,"Democrats continue with their dumb, made up conspiracy theory to lay the groundwork for a protracted legal war over… https://t.co/d3lUfDAPlT",650,,False
1306353272035463175,2020-09-16 22:04:25,"Chris Rock channels Robin DiAngelo: ""It’s the Jackie Robinson thing. It’s written like he broke a barrier, as if th… https://t.co/uWfe3h3EMQ",233,,False
1306347872733061126,2020-09-16 21:42:58,".@LewisForMN: ""The riots are trying to intimidate people, right? Trying to get everybody to conform, which is the g… https://t.co/2IrbyaVe3K",519,,False
1306342515600175104,2020-09-16 21:21:41,WATCH IT HAPPEN: An Oregon woman forced a suspected arsonist to the ground at gunpoint after she allegedly noticed… https://t.co/rQmGAtjtwk,976,,False
1306337443042516993,2020-09-16 21:01:31,".@PressSec: ""'Defund the Police' is not just dangerous policy, it is a poisonous ideology."" https://t.co/LEvkz1Z3kv",1304,,False
1306331879608643586,2020-09-16 20:39:25,"Approximately 48 percent of young Americans lived with their parents in 1940, the earliest year that such data is a… https://t.co/wvcPWkwLYk",128,,False
1306329352993484805,2020-09-16 20:29:22,"RT @AlexMarlow: An investigation should immediately be opened into Democrats colluding with the Chinese Communist Party.
https://t.co/6n7uD…",0,,False
1306326612158427145,2020-09-16 20:18:29,"During a speech to Veterans in Tampa, Joe Biden confused Iraq and Iran for at least the second time. https://t.co/WCI7IRppG7",697,,False
1306321554138165248,2020-09-16 19:58:23,"“It was totally up to Pelosi and the Democrats. Their thing was, ‘We’re going to get him impeached,’ which was neve… https://t.co/4hJKY39ZZI",8027,,False
1306316793418600452,2020-09-16 19:39:28,"Jose Martinez-Lopez allegedly sexually assaulted a girl under the age of 13, according to information obtained from… https://t.co/TRZ9HqLCgd",484,,False
1306311578074206209,2020-09-16 19:18:44,"On Wednesday, 173 Democrats signed a letter calling for an investigation “into new whistleblower allegations of mas… https://t.co/AhOMJbbrKn",144,,False
1306306129878757376,2020-09-16 18:57:06,"A.G. Bill Barr: ""I think, increasingly, the message of the Democrats appears to be, 'Biden or no peace.'” https://t.co/990hQQVwnb",6072,,False
1306300786599759873,2020-09-16 18:35:52,"“What interested me also was his use of the term herd mentality. Now, it’s really herd immunity that he meant to sa… https://t.co/lMVS5JHh8j",218,,False
1306295248348471297,2020-09-16 18:13:51,NOLTE: There are still 48 days until Election Day and three presidential debates. A lot can happen between now and… https://t.co/ezNDJb2aAC,923,,False
1306290108677713922,2020-09-16 17:53:26,Conservative digital activists were smeared as behaving like “Russian trolls” by a recent article in the Washington… https://t.co/n58y6L8vz8,311,,False
1306284385033912322,2020-09-16 17:30:41,The Senate Homeland Security Committee Chairman expects to release an interim report on the Biden-Ukraine investiga… https://t.co/ZZaDB93a4M,765,,False
1306278509061591043,2020-09-16 17:07:20,"A woman clashed with a street preacher during Tuesday evening’s Black Lives Matter (BLM) protest in Philadelphia, c… https://t.co/YKJNyQ7DVK",459,,False
1306273380321112066,2020-09-16 16:46:57,Sen. Josh @HawleyMO unveiled his legislation to provide every member of law enforcement a pay raise. https://t.co/4GSdmPkuly,1320,,False
1306267498883547137,2020-09-16 16:23:35,"Over 7,000 Texas Deplorables fire up the ""Laredo Trump Train""! https://t.co/yNcwWwYFMM",6530,,False
1306261955355783168,2020-09-16 16:01:33,The Chicago Killing Fields yield their gruesome daily harvest. https://t.co/f459vFCWOy,888,,False
1306256529268576256,2020-09-16 15:40:00,"NOLTE: ""The domestic terrorists in Antifa and Black Lives Matter have accomplished one thing: the most costly riots… https://t.co/2ksec1t9Pi",522,,False
1306250704168914946,2020-09-16 15:16:51,"Pope Francis urged Christians to care for creation Wednesday, insisting that the abuse of ecosystems is a “grave si… https://t.co/e9e5s7Gd4l",57,,False
1306244971079532544,2020-09-16 14:54:04,"Anaheim, California, has asked Gov. Gavin Newsom to issue regulations that allow Disneyland and other theme parks t… https://t.co/033C292FOX",251,,False
1306239513505812486,2020-09-16 14:32:23,President Donald Trump on Wednesday shared a meme of former Vice President Joe Biden bobbing his head to the song “… https://t.co/pIXoBvlgcC,609,,False
1306234905261682693,2020-09-16 14:14:04,Kamala Harris stokes the fire. https://t.co/d9LQj7HEyu,393,,False
1306229328544509955,2020-09-16 13:51:55,Gun sales soar as the Leftist Mob continues to roil American cities. https://t.co/RTBE4ktFb3,876,,False
1306223724019036165,2020-09-16 13:29:38,An Oregon woman forced a suspected arsonist to the ground at gunpoint after she allegedly noticed the suspect had m… https://t.co/Bq0OGCgQ1M,1057,,False
1306218084139708417,2020-09-16 13:07:14,"Democrat James Carville is cocky and strutting that Joe Biden will win and President Trump will ""go to jail."" https://t.co/XJkGbkfaqs",412,,False
1306212767419052032,2020-09-16 12:46:06,Gun sales soar as the Leftist Mob continues to roil American cities. https://t.co/4qTK6nvbMt,1003,,False
1306207641862111232,2020-09-16 12:25:44,"Over 1,600 primary ballots hailing from New Jersey's Sussex County were discovered in a ""mislabeled"" bin last week. https://t.co/pqSdsvvD2D",1618,,False
1306202393869275138,2020-09-16 12:04:53,"Is it Harris-Biden? 
Or Biden-Harris?

https://t.co/JyBuXzALNU",644,,False
1306197232241250304,2020-09-16 11:44:22,WATCH IT HAPPEN: An Oregon woman forced a suspected arsonist to the ground at gunpoint after she allegedly noticed… https://t.co/erPs7KKbRh,2423,,False
1306191904086937602,2020-09-16 11:23:12,Oh dear. https://t.co/O37ZTZOA7o,1722,,False
1306186551433535490,2020-09-16 11:01:56,"Joe Biden in July 2019: I’ll ‘Make Sure’ Fracking Is ‘Eliminated' 
Now: ‘I Will Not Ban Fracking’
Which is it? https://t.co/t3K3AoDrUh",892,,False
1306092952670867457,2020-09-16 04:50:00,RT @JxhnBinder: Fashion Notes: Melania Trump Wears Filigree Prada for Historic Middle East Peace Deal https://t.co/2TcDS4y9ca,0,,False
1306074839887876096,2020-09-16 03:38:02,President Donald Trump on Tuesday at an ABC News town hall promised peace in the Middle East without losing America… https://t.co/hll71jlr5j,2294,,False
1306057768743440387,2020-09-16 02:30:12,"“They want more police, they want protection, they suffer more than anybody else by bad police protection."" https://t.co/47MDpWyvIw",866,,False
1306051273008046081,2020-09-16 02:04:23,President Donald Trump on Tuesday repeated that he did not want to issue a national mask mandate during the coronav… https://t.co/gUR0jgbtzZ,1041,,False
1306043191733506048,2020-09-16 01:32:16,Rank-and-file Democrats have increasingly become frustrated with House Speaker Nancy Pelosi’s (D-CA) brinksmanship-… https://t.co/KlYiLYVrjP,565,,False
1306037827289874433,2020-09-16 01:10:57,OUCH. https://t.co/fUHIC0NIev,2408,,False
1306032462552854531,2020-09-16 00:49:38,Nancy Pelosi's decision to play politics right before an election with Americans' economic relief from the Chinese… https://t.co/1bhInGe9wf,1116,,False
1306027295606558720,2020-09-16 00:29:06,"Judd Apatow has slammed Hollywood's willingness to censor its content to appease China, saying that Beijing has suc… https://t.co/jsKAakCERN",716,,False
1306021827689484288,2020-09-16 00:07:23,The American Journal of Psychiatry released a correction to a study which drew as its primary conclusion that indiv… https://t.co/ZGjm4v20cG,171,,False
1306016613293084672,2020-09-15 23:46:39,Very Jake News https://t.co/hJ361KqrEP,251,,False
1306011352021053440,2020-09-15 23:25:45,Another one! https://t.co/jjXcA136pS,2329,,False
1306006132889092100,2020-09-15 23:05:01,Now check this out! https://t.co/OOxjGRxqqD,6206,,False
1306000260884561921,2020-09-15 22:41:41,Further evidence of how Rich Hollywood Elites continue to bow to Communist China to bag more cash. https://t.co/1CysA0lRqb,395,,False
1305994911569924098,2020-09-15 22:20:25,Fox News Channel’s Steve Doocy gave a disclaimer after President Donald Trump said he would be appearing on Fox New… https://t.co/F8vOgxZfHR,132,,False
1305989449214570496,2020-09-15 21:58:43,"Judd Apatow has slammed Hollywood’s willingness to censor its content to appease China, saying that Beijing has suc… https://t.co/PhBRi5dys9",587,,False
1305986970791936001,2020-09-15 21:48:52,RT @joshdcaplan: Pennsylvania Sheriff Switches to GOP: ‘The Democratic Party Has Left Me‘ https://t.co/Dutyz8rWpv,0,,False
1305984196008181760,2020-09-15 21:37:50,"California continues to make strides in the fight against the coronavirus pandemic, with the state recording record… https://t.co/2pYxPp4ASe",201,,False
1305978989962559490,2020-09-15 21:17:09,An Ohio high school has indefinitely suspended two football players for defying orders from the administration and… https://t.co/g3k2EOyqIO,408,,False
1305973702207713280,2020-09-15 20:56:09,Good! https://t.co/KL0eYVI9bM,2562,,False
1305968416709382144,2020-09-15 20:35:08,"Judd Apatow has slammed Hollywood's willingness to censor its content to appease China, saying that Beijing has suc… https://t.co/bo3X3dcNZI",693,,False
1305963085446950913,2020-09-15 20:13:57,"A court security officer was shot outside a federal courthouse in Phoenix on Tuesday, near Seventh Avenue and Van B… https://t.co/ZT1YBRsqQw",280,,False
